{
  "$defs": {
    "field": {
      "additionalProperties": false,
      "properties": {
        "claim_ids": {
          "items": {
            "type": "string"
          },
          "type": "array",
          "uniqueItems": true
        },
        "confidence": {
          "enum": [
            "high",
            "medium",
            "low",
            "none"
          ]
        },
        "status": {
          "enum": [
            "confirmed",
            "supported",
            "working_assumption",
            "design_choice",
            "private_observation",
            "unknown_reported",
            "deferred",
            "conflict"
          ]
        },
        "validation_target": {
          "type": "string"
        },
        "value": {}
      },
      "required": [
        "claim_ids",
        "confidence",
        "status",
        "validation_target",
        "value"
      ],
      "type": "object"
    }
  },
  "$id": "https://github.com/nakatamaho/freedos-pc88va/config/contracts/m04-provisional-pc88va-boot-media.schema.json",
  "$schema": "https://json-schema.org/draft/2020-12/schema",
  "additionalProperties": false,
  "properties": {
    "addressing": {
      "type": "object"
    },
    "blocker_dispositions": {
      "maxItems": 12,
      "minItems": 12,
      "type": "array"
    },
    "boot_record": {
      "type": "object"
    },
    "candidate_media": {
      "minItems": 1,
      "type": "array"
    },
    "component_gitlinks": {
      "type": "object"
    },
    "consumed_identities": {
      "type": "object"
    },
    "contract_id": {
      "const": "m04-provisional-pc88va-boot-media"
    },
    "contract_status": {
      "const": "provisional"
    },
    "derived_invariants": {
      "type": "array"
    },
    "disk_access_candidates": {
      "type": "object"
    },
    "early_diagnostics": {
      "type": "object"
    },
    "evidence_matrix_digest": {
      "pattern": "^[0-9a-f]{64}$",
      "type": "string"
    },
    "filesystem": {
      "type": "object"
    },
    "firmware_dependency": {
      "type": "object"
    },
    "firmware_to_ipl": {
      "type": "object"
    },
    "kernel_loading": {
      "type": "object"
    },
    "kernel_payload_role": {
      "type": "object"
    },
    "open_questions": {
      "type": "array"
    },
    "parent_commit": {
      "pattern": "^[0-9a-f]{40}$",
      "type": "string"
    },
    "preferred_disk_access": {
      "type": "object"
    },
    "readiness": {
      "type": "object"
    },
    "schema_version": {
      "const": 1
    },
    "selected_candidate_medium": {
      "type": "object"
    },
    "source_registry_digest": {
      "pattern": "^[0-9a-f]{64}$",
      "type": "string"
    },
    "target_model": {
      "type": "object"
    }
  },
  "required": [
    "addressing",
    "blocker_dispositions",
    "boot_record",
    "candidate_media",
    "component_gitlinks",
    "consumed_identities",
    "contract_id",
    "contract_status",
    "derived_invariants",
    "disk_access_candidates",
    "early_diagnostics",
    "evidence_matrix_digest",
    "filesystem",
    "firmware_dependency",
    "firmware_to_ipl",
    "kernel_loading",
    "kernel_payload_role",
    "open_questions",
    "parent_commit",
    "preferred_disk_access",
    "readiness",
    "schema_version",
    "selected_candidate_medium",
    "source_registry_digest",
    "target_model"
  ],
  "title": "M04 provisional PC-88VA boot and media contract",
  "type": "object"
}
