{
  "addressing": {
    "interval_convention": {
      "claim_ids": [
        "DEC-FAT12-LAYOUT"
      ],
      "confidence": "high",
      "status": "design_choice",
      "validation_target": "M05 and M08",
      "value": "start_inclusive_end_exclusive"
    },
    "lba_to_chs_formula": {
      "claim_ids": [
        "DER-FAT12-CAPACITY",
        "TXT-FDD-LOGICAL-TRACK",
        "TXT-FDD-SECTOR-ID"
      ],
      "confidence": "high",
      "status": "design_choice",
      "validation_target": "M04 verifier and M05",
      "value": "c=lba//(heads*spt); rem=lba%(heads*spt); h=rem//spt; r=rem%spt+1"
    },
    "logical_sector_numbering": {
      "claim_ids": [
        "DEC-FAT12-LAYOUT"
      ],
      "confidence": "high",
      "status": "design_choice",
      "validation_target": "M05",
      "value": "zero_based_lba"
    },
    "physical_sector_id_base": {
      "claim_ids": [
        "TXT-FDD-SECTOR-ID"
      ],
      "confidence": "high",
      "status": "confirmed",
      "validation_target": "M05 and M08",
      "value": 1
    },
    "raw_image_offset_formula": {
      "claim_ids": [
        "DEC-FAT12-LAYOUT"
      ],
      "confidence": "high",
      "status": "design_choice",
      "validation_target": "M05",
      "value": "byte_offset=lba*bytes_per_sector"
    },
    "track_order": {
      "claim_ids": [
        "TXT-FDD-LOGICAL-TRACK"
      ],
      "confidence": "high",
      "status": "confirmed",
      "validation_target": "M05 and M08",
      "value": "cylinder_major_head_minor"
    }
  },
  "blocker_dispositions": [
    {
      "disposition": {
        "claim_ids": [
          "MD-IPL-STARTUP",
          "UNKNOWN-BOOT-ACCEPTANCE"
        ],
        "confidence": "medium",
        "status": "working_assumption",
        "validation_target": "M07 records and normalizes entry state.",
        "value": "working_assumption"
      },
      "question_id": "M04-BOOT-ENTRY-STATE"
    },
    {
      "disposition": {
        "claim_ids": [
          "UNKNOWN-BOOT-ACCEPTANCE"
        ],
        "confidence": "none",
        "status": "unknown_reported",
        "validation_target": "M07 entry-state experiment.",
        "value": "unknown_reported"
      },
      "question_id": "M04-BOOT-INTERRUPTS"
    },
    {
      "disposition": {
        "claim_ids": [
          "MD-IPL-STARTUP"
        ],
        "confidence": "medium",
        "status": "supported",
        "validation_target": "M07.",
        "value": "supported"
      },
      "question_id": "M04-BOOT-IPL-LOAD"
    },
    {
      "disposition": {
        "claim_ids": [
          "UNKNOWN-BOOT-ACCEPTANCE"
        ],
        "confidence": "none",
        "status": "unknown_reported",
        "validation_target": "Blocks M07 until acceptance rules are observed or documented.",
        "value": "unknown_reported"
      },
      "question_id": "M04-BOOT-SECTOR-FORMAT"
    },
    {
      "disposition": {
        "claim_ids": [
          "DEFER-TIMER"
        ],
        "confidence": "high",
        "status": "deferred",
        "validation_target": "M10.",
        "value": "deferred_m10"
      },
      "question_id": "M04-BOOT-TIMER"
    },
    {
      "disposition": {
        "claim_ids": [
          "DEC-FAT12-LAYOUT",
          "UNKNOWN-BOOT-ACCEPTANCE"
        ],
        "confidence": "medium",
        "status": "design_choice",
        "validation_target": "M05 uses project layout; M07 tests firmware visibility.",
        "value": "design_choice"
      },
      "question_id": "M04-BPB-MEDIA"
    },
    {
      "disposition": {
        "claim_ids": [
          "DEC-DISK-PATH",
          "UNKNOWN-DISK-ENTRY"
        ],
        "confidence": "medium",
        "status": "working_assumption",
        "validation_target": "M07/M08.",
        "value": "working_assumption"
      },
      "question_id": "M04-DISK-SERVICE"
    },
    {
      "disposition": {
        "claim_ids": [
          "DEC-EARLY-TRACE",
          "TXT-TEXT-CHAR-OUTPUT"
        ],
        "confidence": "high",
        "status": "design_choice",
        "validation_target": "M07 trace; M09 console.",
        "value": "design_choice"
      },
      "question_id": "M04-EARLY-CONSOLE"
    },
    {
      "disposition": {
        "claim_ids": [
          "DEC-DISK-PATH"
        ],
        "confidence": "medium",
        "status": "deferred",
        "validation_target": "M12 read path and M14 write/media change; reopen earlier only if firmware candidate fails.",
        "value": "deferred_m12"
      },
      "question_id": "M04-FDC-DMA-IRQ"
    },
    {
      "disposition": {
        "claim_ids": [
          "TXT-FDD-2HD-GEOMETRY",
          "TXT-FDD-LOGICAL-TRACK"
        ],
        "confidence": "high",
        "status": "confirmed",
        "validation_target": "M05 arithmetic and M07 boot acceptance.",
        "value": "confirmed"
      },
      "question_id": "M04-FLOPPY-GEOMETRY"
    },
    {
      "disposition": {
        "claim_ids": [
          "DEFER-KEYBOARD"
        ],
        "confidence": "high",
        "status": "deferred",
        "validation_target": "M11 and M17.",
        "value": "deferred_m11"
      },
      "question_id": "M04-KEYBOARD-ENCODING"
    },
    {
      "disposition": {
        "claim_ids": [
          "UNKNOWN-KERNEL-HANDOFF"
        ],
        "confidence": "none",
        "status": "unknown_reported",
        "validation_target": "Blocks M08; M06 must first define a VA startup contract.",
        "value": "unknown_reported"
      },
      "question_id": "M04-KERNEL-LOAD"
    }
  ],
  "boot_record": {
    "acceptance_rule": {
      "claim_ids": [
        "UNKNOWN-BOOT-ACCEPTANCE"
      ],
      "confidence": "none",
      "status": "unknown_reported",
      "validation_target": "Blocks M07.",
      "value": null
    },
    "bpb_status": {
      "claim_ids": [
        "DEC-FAT12-LAYOUT",
        "UNKNOWN-BOOT-ACCEPTANCE"
      ],
      "confidence": "medium",
      "status": "design_choice",
      "validation_target": "M05 serializes the project layout; M07 determines firmware visibility.",
      "value": "project_fat12_layout_only_firmware_visibility_unknown"
    },
    "candidate_location": {
      "claim_ids": [
        "DEC-FAT12-LAYOUT",
        "MD-IPL-STARTUP"
      ],
      "confidence": "medium",
      "status": "design_choice",
      "validation_target": "M05 constructs the reserved sector; M07 tests firmware selection.",
      "value": "logical_sector_0_of_selected_medium"
    },
    "code_and_reserved_ranges": {
      "claim_ids": [
        "UNKNOWN-BOOT-ACCEPTANCE"
      ],
      "confidence": "none",
      "status": "unknown_reported",
      "validation_target": "M07",
      "value": null
    },
    "failure_or_fallback": {
      "claim_ids": [
        "UNKNOWN-BOOT-ACCEPTANCE"
      ],
      "confidence": "none",
      "status": "unknown_reported",
      "validation_target": "M07 records firmware behavior without relying on it for recovery.",
      "value": null
    },
    "firmware_loaded_extent": {
      "claim_ids": [
        "MD-IPL-STARTUP"
      ],
      "confidence": "medium",
      "status": "supported",
      "validation_target": "M07",
      "value": 1
    },
    "physical_sector_size": {
      "claim_ids": [
        "TXT-FDD-2HD-GEOMETRY"
      ],
      "confidence": "high",
      "status": "confirmed",
      "validation_target": "M05",
      "value": 1024
    },
    "signature": {
      "claim_ids": [
        "UNKNOWN-BOOT-ACCEPTANCE"
      ],
      "confidence": "none",
      "status": "unknown_reported",
      "validation_target": "Blocks M07 until a complete source or bounded acceptance experiment resolves it.",
      "value": null
    }
  },
  "candidate_media": [
    {
      "candidate_id": "pc88va-2hd-mfm-1024-provisional",
      "firmware_boot_support": {
        "claim_ids": [
          "UNKNOWN-BOOT-ACCEPTANCE"
        ],
        "confidence": "none",
        "status": "unknown_reported",
        "validation_target": "M07",
        "value": null
      },
      "selection": {
        "claim_ids": [
          "DEC-MEDIUM-SELECTION"
        ],
        "confidence": "medium",
        "status": "design_choice",
        "validation_target": "M05 and M07",
        "value": "selected_for_m05_candidate"
      }
    }
  ],
  "component_gitlinks": {
    "country": "23f189cca3420606eae8723884fa92ccd65eb307",
    "fdkernel": "6523acdb87f4665e6068ea331859885267242005",
    "freecom": "855281a3114b43ad4b8d9a320f2aca39be046bba"
  },
  "consumed_identities": {
    "components_lock_sha256": "440e481b28c740875489a6953a246ce5370c44074053c7aad3f80e79ec40c19c",
    "m01_contract_sha256": "7d66be32b508395d8c36a902389f368e9f38d9abab08085bda89e3d2c5d6d578",
    "m01_golden_sha256": "6fcfe834f90ffc602589ddc63b50d90eba33bbc1802b6bff3c9ef6b9d397c7c3",
    "m02_golden_sha256": "4d4e92f92911130109b5b140b2202fc1dfc3abb9af3cd7501b685894d0cb78fd",
    "m02_sidecar_sha256": "0ffe8a10fd1c430fc876a7387e44fe6084be5b21deaf93bb8826a3b13b278fbb",
    "m02_tar_sha256": "00fb02b03ea16423b5987d455a8ea11a8a567c699484656228722119c6239e51",
    "m02_tar_size": 399360,
    "m03r1_census_entries": 14455,
    "m03r1_golden_sha256": "d871c7f188313218c2c9481ea9fe7c6abf6acd6369f996b2641021ad27c80550",
    "m03r1_projection_sha256": "70bee9fedaa526f58a795c2acd43e3492a23e1554bcf843160bce7316120a42c",
    "m03r1_projection_size": 10039882,
    "m03r1_routing_sha256": "dbb28f45c16d59b97fab8defa21ce4a866d51c701826987ce26a3b50ad8c938e",
    "m03r1_ruleset_sha256": "57b8b299537bb9ca226e48cbd5bbf5dfe19da87d89ca3250c56a008fb9b0934c",
    "m03r1_schema_sha256": "08af162ec4c6def748ebc57e1b48aa7e38a82e203615feb736458b53c8b35548",
    "toolchain_lock_sha256": "39c5b3052d71463235a26e8704ab54c1fedb51ee75bb4efb55e6229391a95162"
  },
  "contract_id": "m04-provisional-pc88va-boot-media",
  "contract_status": "provisional",
  "derived_invariants": [
    {
      "formula": "80*2*8*1024=1310720",
      "name": "media_capacity",
      "status": "evaluated_pass"
    },
    {